Story,Scene,Load Level,Justification
Sleepy Hollow,Scene 1,Low,"Ichabod is introduced already as an outsider, and he remains so."
Sleepy Hollow,Scene 2,Medium,"He courts Katrina, signaling potential social advancement."
Sleepy Hollow,Scene 3,Medium,Ichabod begins to believe in the Headless Horseman legend.
Sleepy Hollow,Scene 4,High,The confrontation with the Horseman forces a psychological shift into fear and desperation.
Sleepy Hollow,Scene 5,High,"Ichabod disappears—whether real or symbolic, he is removed from the town’s story."
Sleepy Hollow,Scene 6,Medium,"The town’s perception of Ichabod changes post-disappearance, cementing myth over man."
